{
  "$schema": "../schemas/privacy.schema.json",
  "schema_version": 1,
  "title": "Privacy policy for Indic NotePad",
  "effective_date": "2026-10-26",
  "summary": "Draft privacy notice. Replace it with verified product-specific information.",
  "sections": [
    {
      "id": "data",
      "title": "Information and permissions",
      "paragraphs": [
        "Document actual collection, processing, permissions, sharing, third-party services, backups, retention and deletion before publication."
      ],
      "bullets": []
    }
  ]
}
